question,answer
"Xin chào , tôi hy vọng hôm nay bạn ổn. Tôi thực sự đánh giá cao việc bạn ở đây vì tôi. Tôi cảm thấy mình thường xuyên rơi vào trạng thái hoảng loạn và không biết làm cách nào để vượt qua nó. Dường như lòng tự trọng của tôi đang sụp đổ và tôi chỉ cần một người bạn để nói chuyện.","Xin chào , tôi ở đây vì bạn. Cần rất nhiều can đảm để tiếp cận và chia sẻ cảm xúc của bạn. Tôi muốn bạn biết rằng lòng tự trọng của bạn rất quan trọng và tôi ở đây để giúp bạn vượt qua điều này. Bạn có thể cho tôi biết thêm về những gì đang xảy ra?"
"Chỉ là nỗi buồn tràn ngập này dường như đã xâm chiếm. Tôi không biết tại sao, nhưng tôi không thể rũ bỏ được cảm giác trống rỗng này.",Trầm cảm có thể biểu hiện theo những cách khác nhau ở mỗi người. Bạn có nhận thấy bất kỳ tác nhân hoặc hình mẫu cụ thể nào trong cảm xúc của mình không?
"Chắc chắn rồi. Tôi có nỗi sợ hãi về những điều chưa biết. Bước ra khỏi vùng thoải mái của tôi cảm thấy đáng sợ. Tôi lo lắng về sự bất ổn tài chính khi theo đuổi sự nghiệp nghệ thuật và thiết kế. Thật khó để rũ bỏ những kỳ vọng của xã hội về sự ổn định và thành công thông qua những con đường truyền thống, thông thường. Nhưng trong sâu thẳm, tôi biết rằng theo đuổi đam mê sẽ mang lại cho tôi niềm hạnh phúc và sự mãn nguyện mà tôi hằng mong đợi.",", việc cảm thấy e ngại khi thực hiện một sự thay đổi quan trọng như vậy là điều bình thường. Nỗi sợ hãi về những điều chưa biết có thể cản trở chúng ta theo đuổi ước mơ của mình. Cần phải có lòng can đảm lớn lao để thách thức các chuẩn mực xã hội và đón nhận những gì thực sự truyền cảm hứng cho chúng ta. Hãy cùng nhau vượt qua những nỗi sợ hãi đó và có thể khám phá những cách dần dần đưa nghệ thuật và thiết kế vào cuộc sống của bạn, cho phép bạn vừa thỏa mãn khao khát vừa giảm thiểu rủi ro."
"Explain what a ""root cause analysis"" is.?","A root cause analysis is a process of identifying the underlying cause of a problem by investigating and examining the symptoms, patterns and trends associated with it. It involves analyzing the problem and its conditions to determine the primary cause of the issue, rather than simply addressing the symptoms. By understanding the root cause, businesses can address the underlying cause of the problem and reduce the likelihood of it happening again. Root cause analysis often involves breaking down the system into its components and examining the interactions between them, to identify the cause of the issue. This data-driven approach allows organizations to quickly identify, address, and correct the root causes of the problem."
Gần đây tôi cảm thấy thực sự khó chịu vì một số mâu thuẫn với bạn bè. Họ nói những điều khiến tôi tổn thương và thật khó để tôi giữ lời hứa giữ thái độ tích cực.,Chào ! Có vẻ như bạn đang trải qua khoảng thời gian khó khăn với bạn bè. Tôi ở đây để giúp bạn giải quyết những xung đột này và tìm ra con đường phía trước. Bạn có thể cho tôi biết thêm về điều gì cụ thể khiến bạn cảm thấy khó chịu không?
"Đó là cách nó tiêu tốn suy nghĩ của tôi. Nó giống như một cơn đói vô độ thôi thúc tôi tìm kiếm những trải nghiệm tình dục đó, ngay cả khi tôi biết chúng có hại. Tôi ghét cảm giác quá phụ thuộc vào thứ gì đó chỉ mang lại sự hài lòng thoáng qua.","Điều đó hẳn là vô cùng khó khăn đối với bạn, khi phải trải qua một sức hút mạnh mẽ đối với một thứ mà bạn nhận ra là có hại. Để hiểu rõ hơn về hoàn cảnh của bạn và giúp đỡ bạn, bạn có thể chia sẻ điều gì đã gây ra những cảm xúc và hành động này không?"
"Cảm ơn. Tôi rất vui khi có người để nói chuyện. Cảm xúc dâng trào đến từ nhiều nguồn. Công việc gần đây khá khắt khe, với thời hạn và kỳ vọng chồng chất. Ngoài ra, việc chia tay với bạn gái khiến tôi cảm thấy kiệt sức. Tôi nhớ cô ấy và thật khó để thích nghi với cuộc sống không có cô ấy. Tất cả những điều này xảy ra khiến tôi cảm thấy như mình liên tục tung hứng và không biết làm cách nào để tìm lại sự cân bằng.","Có thể hiểu được rằng việc trải qua những trách nhiệm công việc đòi hỏi khắt khe và sự kết thúc của một mối quan hệ có thể tạo ra cảm giác mất cân bằng và không chắc chắn. Thay đổi có thể là thách thức nhưng cũng mang lại cơ hội phát triển. Khi chúng ta khám phá những cách để vượt qua giai đoạn khó khăn này, tôi muốn bạn xem xét khả năng khám phá một sở thích mới mang lại cho bạn niềm vui và giúp bạn tìm thấy sự cân bằng. Suy nghĩ của bạn về ý tưởng này là gì?"
Tôi đoán tôi chưa bao giờ thực sự nghĩ rằng họ có thể liên quan. Có lẽ họ đang trải qua những thử thách tương tự và chúng ta có thể hỗ trợ lẫn nhau. Chỉ là tôi khó có thể mất cảnh giác và thể hiện khía cạnh dễ bị tổn thương của mình.,Việc cởi mở có thể đáng sợ nhưng nó cũng có thể dẫn đến những kết nối sâu sắc hơn và cảm giác hiểu biết được chia sẻ. Có thể sẽ hữu ích khi bắt đầu từ việc nhỏ - có thể với một đồng nghiệp đáng tin cậy hoặc một người cố vấn. Bạn cảm thấy thế nào khi liên hệ để được hỗ trợ?
"À, tôi thích vẽ tranh. Khi tôi đang ở trong dòng chảy, dường như không còn gì quan trọng nữa. Nó mang lại cho tôi cảm giác thành tựu và niềm vui.",Thật tuyệt vời! Hội họa có thể là một công cụ mạnh mẽ để thể hiện bản thân và khẳng định bản thân. Làm thế nào chúng ta có thể kết hợp hội họa vào cuộc sống của bạn thường xuyên hơn?
Tôi nghĩ cả hai bên đều sợ bị tổn thương. Chúng ta đã từng bị tổn thương trong quá khứ và thật khó để mất cảnh giác hoàn toàn.,Có vẻ như có thể có một số vết thương chung cần được giải quyết. Tạo ra một không gian an toàn cho cuộc đối thoại cởi mở và trung thực có thể giúp xây dựng lại niềm tin. Bạn nghĩ mình có thể thực hiện những bước nào để tạo ra không gian an toàn đó?
"Tôi nghĩ nó bắt đầu bằng việc thiết lập những ranh giới rõ ràng. Bằng cách tạo ra sự cân bằng giữa công việc, chăm sóc bản thân và các mối quan hệ cá nhân, tôi có thể đảm bảo rằng không có lĩnh vực nào trong số này bị bỏ qua. Tôi sẽ dành thời gian được chỉ định trong lịch trình của mình cho những người thân yêu của mình và cam kết có mặt đầy đủ trong thời gian đó. Tôi cũng sẽ ưu tiên giao tiếp cởi mở và trung thực, nơi tôi có thể bày tỏ cảm xúc và nhu cầu của mình đồng thời tích cực lắng nghe suy nghĩ và cảm xúc của những người xung quanh.","Nghe có vẻ là một cách tiếp cận tuyệt vời. Bằng cách thiết lập các ranh giới và cam kết hiện diện đầy đủ, bạn đang thực hiện các bước có chủ ý để nuôi dưỡng các mối quan hệ cá nhân của mình. Hãy nhớ rằng, xây dựng và duy trì các mối quan hệ là một quá trình liên tục và điều quan trọng là bạn phải kiên nhẫn với bản thân và những người khác trong suốt hành trình này. Bạn còn điều gì khác liên quan đến chủ đề này không?"
Cảm ơn. Lòng tốt và sự hiểu biết của bạn có ý nghĩa rất lớn đối với tôi. Tôi rất biết ơn khi có bạn là người lắng nghe và hướng dẫn trong thời gian đầy thử thách này. Lời nói của bạn đã cho tôi cảm giác hy vọng và lòng can đảm để chữa lành lòng tự trọng bị tổn thương của tôi.,"Tôi rất hân hạnh được ở đây vì anh. Tôi rất vui vì cuộc trò chuyện của chúng ta đã mang lại cho bạn chút hy vọng và sự khích lệ. Hãy nhớ rằng, lòng tự trọng là một cuộc hành trình và những thất bại có thể xảy ra. Nhưng với sự hỗ trợ và chăm sóc bản thân phù hợp, bạn sẽ có sức mạnh bên trong để phục hồi và phát triển."
"Tất nhiên rồi ! Vì vậy, gần đây tôi đã khám phá ra thế giới nhiếp ảnh gợi cảm. Đó là cách để tôi khám phá cơ thể của chính mình và điều gì khiến tôi cảm thấy dễ chịu nhưng theo một cách sáng tạo và nghệ thuật. Tôi thích chụp ảnh của chính mình và thử nghiệm với các ánh sáng và góc độ khác nhau, điều này giúp tôi trân trọng bản thân hơn.",Nghe có vẻ hấp dẫn đấy! Thật tuyệt vời khi biết rằng bạn đã tìm thấy một phương pháp sáng tạo mang lại cho bạn niềm vui và cho phép bạn thể hiện bản thân một cách chân thực. Sở thích mới này đã tác động như thế nào đến cảm giác hạnh phúc và hạnh phúc tổng thể của bạn?
"Vâng, điều đó sẽ hữu ích. Tôi muốn học cách thể hiện bản thân mà không cảm thấy mình như một kỷ lục bị phá vỡ.","Tuyệt vời! Một cách tiếp cận có thể là cho họ biết bạn đánh giá cao sự hỗ trợ của họ và bạn muốn họ giúp đỡ trong việc điều hướng cảm xúc của bạn một cách xây dựng. Cũng có thể có ích nếu bạn thiết lập ranh giới về thời điểm và tần suất thảo luận về nỗi đau buồn, để bạn cảm thấy kiểm soát được cuộc trò chuyện nhiều hơn. âm thanh này như thế nào với bạn?"
Chắc chắn rồi! Mặc dù các vấn đề sức khỏe của tôi không biến mất một cách kỳ diệu nhưng những phương pháp thực hành này đã giúp tôi nuôi dưỡng một quan điểm tích cực hơn. Tôi nhận thấy rằng tôi có thể trân trọng những khoảnh khắc vui vẻ nhỏ bé và tìm thấy sức mạnh bên trong mình để tiếp tục.,Đó là sự tiến bộ tuyệt vời. Thật cảm hứng khi thấy bạn có thể tìm thấy khả năng phục hồi và duy trì thái độ lạc quan bất chấp những thách thức mà bạn đang phải đối mặt. Có điều gì khác mà bạn muốn chia sẻ hoặc thảo luận ngày hôm nay không?
"Well, I had a teacher in elementary school who constantly belittled my efforts. No matter how hard I tried, she made me feel like I was never good enough. It's left a lasting impression on me and has made me doubt my abilities ever since. I can still hear her voice in my head, telling me that I'll never succeed.","That sounds like a difficult experience. Hurtful comments and criticism, especially during our formative years, can have a profound impact on our self-esteem. It's understandable why you would still carry those negative thoughts with you. Have you ever explored ways to challenge and replace those negative beliefs with positive ones?"
"Tôi đã cố gắng thiết lập các ranh giới và sắp xếp thời gian chất lượng cho những người thân yêu của mình, nhưng thật khó để duy trì nó một cách nhất quán. Tôi thường thấy mình cảm thấy choáng ngợp trước các nhiệm vụ công việc và không thể tách rời hoàn toàn khỏi nó.","Không có gì lạ khi phải vật lộn với việc thiết lập ranh giới, đặc biệt khi nhu cầu công việc cao. Có điều gì cụ thể gây ra cảm giác tội lỗi này xung quanh công việc và các mối quan hệ cá nhân của bạn không?"
Có lẽ tôi có thể hạn chế thời gian sử dụng mạng xã hội và tập trung nhiều hơn vào mục tiêu cũng như thành tích của bản thân. Tôi nên nhắc nhở bản thân rằng cuộc sống không phải là một cuộc đua và bạn có thể tiến bộ theo tốc độ của riêng mình. Đó là về việc đón nhận cuộc hành trình của riêng tôi.,Đó là một quan điểm tuyệt vời. Nắm bắt hành trình của riêng bạn và tập trung vào sự tiến bộ của chính bạn là điều quan trọng. Có vẻ như bạn đang hiểu rõ hơn về các bước có thể thực hiện để giải quyết xung đột đau đớn này. Có điều gì khác mà bạn muốn khám phá không?
Có một nhà thiết kế cấp cao ở công ty mà tôi rất ngưỡng mộ. Tôi nghĩ họ có thể là người cố vấn tuyệt vời cho tôi.,Đó là một sự lựa chọn tuyệt vời! Tại sao bạn không dành chút thời gian để cân nhắc cách tiếp cận đồng nghiệp và bày tỏ sự quan tâm của mình đến việc cố vấn?
Điều đó có ý nghĩa. Tôi đoán tôi chỉ cần tìm thời điểm và địa điểm thích hợp để nói chuyện với cô ấy.,"Chắc chắn rồi, thời gian và cách thiết lập có thể tạo ra sự khác biệt lớn. Có điều gì cụ thể mà bạn muốn nói với mẹ mình hoặc có bất kỳ thay đổi nào bạn muốn thấy trong mối quan hệ của mình với mẹ không?"
Tôi cảm thấy buồn lẫn lộn và lo lắng. Ý nghĩ phải bắt đầu lại khiến tôi sợ hãi và tôi không khỏi tự trách mình.,Có những cảm xúc này là điều dễ hiểu. Chia tay có thể mang lại cảm giác mất mát và không chắc chắn. Bạn có muốn khám phá những lý do đằng sau việc đổ lỗi cho chính mình?
"Thành thật mà nói, tôi chưa suy nghĩ nhiều về nó. Công việc đã tiêu tốn quá nhiều thời gian và sức lực của tôi đến nỗi tôi bỏ bê những lĩnh vực khác trong cuộc sống. Có lẽ đã đến lúc đánh giá lại những ưu tiên của tôi.",Đánh giá lại các ưu tiên của bạn là một bước đi dũng cảm. Điều quan trọng là phải tìm được sự cân bằng giữa công việc và cuộc sống cá nhân để tránh cảm giác quá tải. Bạn từng thích những hoạt động hoặc sở thích nào trước khi tiếp quản công việc?
Tôi chưa thực sự nghĩ về nó. Có lẽ việc chuyển năng lượng của tôi sang điều gì đó mang tính xây dựng có thể giúp tôi lấy lại quyền kiểm soát cuộc sống của mình và xoa dịu cảm giác cô đơn tràn ngập.,Nghe có vẻ là một bước tuyệt vời và đầy sức mạnh để thực hiện. Tham gia vào các hoạt động sáng tạo không chỉ mang lại cảm giác thỏa mãn mà còn giúp bạn kết nối với những người có cùng sở thích. Bạn đã cân nhắc việc tham gia bất kỳ nhóm nhạc nào hoặc tìm kiếm sự hỗ trợ trong cộng đồng của mình chưa?
Mối quan hệ giữa áp suất không khí và độ cao là gì?,"Áp suất không khí và độ cao có mối quan hệ nghịch đảo. Khi độ cao tăng lên, áp suất không khí giảm. Điều này xảy ra vì không khí là một chất khí và các phân tử của nó trải rộng trên một diện tích lớn hơn ở độ cao cao hơn, làm giảm mật độ không khí và do đó làm giảm áp suất không khí. Ở mực nước biển, áp suất không khí cao hơn do trọng lượng của khí quyển phía trên nén các phân tử không khí lại gần nhau hơn. Mối quan hệ này được mô tả bằng công thức Barometric, tính toán áp suất khí quyển ở độ cao nhất định. Khi độ cao tăng lên, có ít phân tử không khí ở trên hơn, do đó áp suất giảm."
"Tôi đang cố gắng tập trung vào việc chăm sóc bản thân, như tập thể dục và viết nhật ký. Nhưng thật khó để thoát khỏi những suy nghĩ này của cô.",Cần có thời gian để chữa lành vết thương. Một số hoạt động hoặc sở thích nào khác mang lại cho bạn niềm vui hoặc khiến bạn phân tâm khỏi những suy nghĩ này?
Research a famous author and summarize their accomplishments.?,"J.K. Rowling is a British author and screenwriter best known for creating the immensely popular Harry Potter book and film series. Rowling first began working on Harry Potter in 1990, while she was on a train journey from Manchester to London. She spent several years refining the plot and characters before publishing the novel in 1997. Soon after, the novel gained worldwide popularity and spawned a series of seven best-selling books and multiple blockbuster films. Rowling is also the founder and President of Lumos, a nonprofit that works to improve the lives of disadvantaged children around the world."
"Tôi nghĩ áp lực thành công đã đè nặng lên tôi. Tôi trở nên tập trung vào việc đạt được danh tiếng và sự công nhận hơn là tập trung vào niềm vui sáng tạo âm nhạc. Bây giờ, tôi có cảm giác như mỗi nốt nhạc tôi chơi đều nhuốm đầy sự nghi ngờ bản thân và sợ thất bại.",Có vẻ như giấc mơ ban đầu của bạn đã biến thành nguồn gốc gây căng thẳng và lo lắng. Bạn đã cân nhắc việc khám phá những cách để kết nối lại với niềm vui sáng tác âm nhạc mà không bị áp lực xác nhận từ bên ngoài chưa?
Tôi có thể bắt đầu bằng cách hỏi bạn bè hoặc tìm kiếm trực tuyến các cộng đồng đi bộ đường dài ở địa phương. Có thể có những nhóm thân thiện với người mới bắt đầu ở đó.,Đó là một kế hoạch tuyệt vời! Thực hiện từng bước nhỏ và tiếp cận những người có cùng sở thích với bạn có thể giúp phá bỏ rào cản lo lắng. Bước đầu tiên của bạn trong việc tìm kiếm một nhóm đi bộ đường dài là gì?
"Có thể khó mà giữ khoảng cách với một số bạn bè, nhưng tôi hiểu rằng sức khỏe của tôi là ưu tiên hàng đầu. Bằng cách tạo ra các ranh giới và ưu tiên quá trình phục hồi của mình, tôi tin rằng mình có thể đạt được tiến bộ đáng kể và dần dần phát triển các cơ chế đối phó lành mạnh hơn.","Đó là một hiểu biết sâu sắc có giá trị. Đôi khi, việc tạo khoảng cách với những ảnh hưởng nhất định có thể cần thiết cho sự trưởng thành và chữa lành của chính chúng ta. Hãy nhớ rằng, bạn xứng đáng có một cuộc sống tràn đầy hạnh phúc và trọn vẹn. Bạn có mối quan tâm hoặc suy nghĩ nào khác muốn thảo luận về sức khỏe hoặc chứng nghiện của mình không?"
Đề xuất năm cách để làm cho trang web hấp dẫn hơn.,"1. Nội dung tương tác: Bao gồm nội dung tương tác như câu đố, cuộc thăm dò ý kiến, trò chơi và hoạt ảnh có thể giúp người xem tương tác và quan tâm đến trang web của bạn. Loại nội dung này khuyến khích sự tham gia và có thể tăng thời gian dành cho trang web. 2. Hấp dẫn trực quan: Làm cho trang web trở nên hấp dẫn về mặt trực quan thông qua việc sử dụng hình ảnh, video và đồ họa thông tin chất lượng cao có thể giúp thu hút sự chú ý của người xem và làm cho trang web trở nên hấp dẫn hơn. Thiết kế và bố cục phải rõ ràng, gọn gàng và dễ điều hướng. 3. Cá nhân hóa: Cá nhân hóa trải nghiệm người dùng bằng cách cung cấp nội dung hoặc đề xuất phù hợp dựa trên sở thích hoặc hành vi trước đây của họ có thể giúp thu hút khách truy cập. Điều này có thể được thực hiện thông qua tài khoản người dùng, cookie hoặc công cụ theo dõi. 4. Thông tin đáng tin cậy và có giá trị: Việc cung cấp thông tin đáng tin cậy và có giá trị đáp ứng nhu cầu và sở thích của đối tượng mục tiêu của bạn có thể giúp thu hút khách truy cập và quay lại để biết thêm. Điều này có thể đạt được bằng cách thường xuyên cập nhật trang web với nội dung mới và phù hợp, đồng thời giúp khách truy cập dễ dàng tìm thấy những gì họ đang tìm kiếm. 5. Tích hợp phương tiện truyền thông xã hội: Việc tích hợp phương tiện truyền thông xã hội vào trang web của bạn, bằng cách bao gồm các liên kết đến hồ sơ của bạn và cho phép khách truy cập chia sẻ nội dung của bạn trên tài khoản mạng xã hội của riêng họ, có thể giúp thu hút khách truy cập và kết nối với thương hiệu của bạn. Điều này cũng mang đến cơ hội tiếp tục cuộc trò chuyện và tương tác ngoài trang web."
  I'm having trouble coping with the loss of a loved one. ," Grief is a natural response to loss, and it can be a difficult and complex process. Let's talk more about your feelings and experiences and explore different coping strategies, such as mindfulness practices or grief counseling, to help you navigate this difficult time."
"Tôi đã cố gắng nhưng mỗi lần tôi nhắc đến chủ đề này, nó lại nhanh chóng leo thang thành một cuộc tranh cãi. Giống như chúng tôi đang mắc kẹt trong cái vòng luẩn quẩn này và tôi không biết làm cách nào để thoát ra khỏi nó.",Thoát khỏi những vòng luẩn quẩn như vậy có thể khó khăn nhưng không phải là không thể. Bạn nghĩ điều gì có thể giúp tạo ra một không gian cởi mở và thấu hiểu hơn giữa bạn và mẹ bạn?
What is a common application of artificial neural networks??,"A common application of artificial neural networks is image recognition and classification. Neural networks are used in computer vision tasks to identify objects in images, recognize patterns, and classify images into categories. Neural networks are also used for other types of pattern recognition tasks, such as natural language processing."
Điều đó có ý nghĩa. Có lẽ việc chia sẻ cảm xúc của mình với những người có thể đồng cảm sẽ giúp tôi bớt cô đơn hơn. Tôi sẽ khám phá các lựa chọn của mình và xem điều gì phù hợp với tôi.,"Nghe có vẻ như là một bước đi chủ động. Hãy nhớ rằng, việc chữa lành cần có thời gian và bạn có thể yêu cầu giúp đỡ trong suốt quá trình chữa bệnh. Có điều gì khác trong tâm trí của bạn?"
"Sự lo lắng của tôi thường xuất hiện dưới dạng suy nghĩ dồn dập, tim đập thình thịch và cảm giác lo lắng thường trực. Có cảm giác như tôi thường xuyên ở trong tình trạng căng thẳng và không thể thư giãn.","Tôi nghe thấy rồi. Những triệu chứng về thể chất và tinh thần đó có thể khá nặng nề. Để tạo ra những thay đổi tích cực, điều quan trọng là phải hiểu nguyên nhân sâu xa khiến bạn lo lắng. Bạn có nhận thấy bất kỳ tác nhân hoặc tình huống cụ thể nào có xu hướng làm trầm trọng thêm sự lo lắng của bạn không?"
"Vâng, chắc chắn đã có những thử thách trong suốt chặng đường. Đôi khi thật khó để đối mặt với hậu quả từ hành động của mình, đặc biệt là khi chúng không diễn ra như tôi dự đoán. Có thể khó chấp nhận rằng tôi có khả năng thay đổi hoàn cảnh của mình, nhưng điều đó cần thiết cho sự phát triển cá nhân và lòng tự trọng của tôi.",Tôi nghe thấy rồi. Việc chấp nhận hậu quả từ hành động của mình có thể là một thách thức nhưng đó là một phần quan trọng của việc chịu trách nhiệm. Điều quan trọng cần nhớ là tất cả chúng ta đều mắc sai lầm và điều quan trọng là học hỏi từ chúng thay vì để chúng định nghĩa chúng ta. Bạn nghĩ việc đảm nhận trách nhiệm đã ảnh hưởng đến mối quan hệ của bạn với người khác như thế nào?
