question,answer
"Tôi phải thừa nhận, phản ứng ban đầu của tôi là sốc và bối rối. Tôi luôn tưởng tượng cuộc sống của chúng tôi sẽ ổn định và vững chắc hơn. Nó giống như một sự thay đổi đột ngột trong tầm nhìn chung của chúng tôi về tương lai.","Cảm giác đó hoàn toàn có thể hiểu được. Khi những kỳ vọng và kế hoạch của chúng ta bị thách thức, chúng ta có thể khá mất phương hướng. Bạn và hôn thê của bạn điều hướng cuộc trò chuyện này như thế nào?"
Tôi cởi mở với ý tưởng này. Tôi nghĩ việc có một bên thứ ba trung lập thực sự có thể giúp chúng tôi có được một số quan điểm và tìm ra con đường phía trước. Nhưng tôi cũng sợ rằng liệu pháp trị liệu có thể tiết lộ một số sự thật khó chịu hoặc khiến tôi phải đối mặt với những điều mà tôi chưa sẵn sàng đối mặt.,"Cảm thấy sợ hãi là điều hoàn toàn có thể hiểu được. Trị liệu là không gian nơi bạn có thể kiểm soát và có thể khám phá theo tốc độ của riêng mình. Cùng nhau, chúng ta có thể tạo ra một môi trường an toàn để giải quyết xung đột mà không làm bạn choáng ngợp. Bạn muốn bắt đầu giải quyết vấn đề này như thế nào? Bạn nghĩ bạn cần gì từ liệu pháp trị liệu?"
Chào ! Tôi chỉ cần chia sẻ điều này với bạn. Tôi ngạc nhiên về việc mình đã trưởng thành hơn bao nhiêu kể từ khi bắt đầu trị liệu. Tôi không thể tin được mình lại là con người như cách đây vài tháng. Thật đáng kinh ngạc khi khám phá được tiềm năng tiềm ẩn trong tôi.,Xin chào ! Tôi rất vui khi biết rằng bạn cảm thấy ngạc nhiên trước sự trưởng thành của mình. Thật đáng kinh ngạc khi liệu pháp trị liệu có thể giúp chúng ta khám phá những sức mạnh và khả năng tiềm ẩn mà chúng ta thậm chí không biết là mình có. Bạn nhận thấy những thay đổi cụ thể nào ở bản thân?
"Tôi nghĩ mọi chuyện bắt đầu khi tôi không được thăng chức như mong đợi ở nơi làm việc. Tôi đã nỗ lực rất nhiều và điều đó giống như một đòn giáng mạnh vào lòng tự trọng của tôi. Kể từ đó, tôi nghi ngờ khả năng của mình và cảm thấy không chắc chắn về giá trị của mình.","Mất cơ hội thăng tiến chắc chắn có thể khiến bạn nản lòng. Tuy nhiên, điều quan trọng cần nhớ là một thất bại không quyết định được khả năng hay giá trị của bạn. Hãy cho tôi biết, bạn có những thành tựu hoặc điểm mạnh nào có thể giúp bạn lấy lại sự tự tin?"
Tôi từng thích đi dạo dài trong thiên nhiên và vẽ tranh. Có lẽ tôi có thể bắt đầu kết hợp những hoạt động đó vào cuộc sống của mình.,"Tuyệt vời! Tôi khuyến khích bạn bắt đầu với những bước nhỏ. Bắt đầu bằng cách đi bộ ngắn trong thiên nhiên hoặc cầm cọ vẽ vài phút mỗi ngày. Hãy nhớ rằng, quá trình này là quá trình khám phá bản thân và tìm kiếm niềm vui trong chính bạn. Nghe như thế nào?"
"Việc tự chăm sóc bản thân là rất quan trọng trong thời gian đầy thử thách này. Tôi sẽ đảm bảo dành thời gian cho các hoạt động mang lại niềm vui và giúp tôi thư giãn. Cho dù đó là đi dạo giữa thiên nhiên, dành thời gian với những người bạn nâng đỡ tôi hay thực hành các bài tập chánh niệm, tôi muốn ưu tiên sức khỏe cảm xúc của bản thân. Bằng cách chăm sóc bản thân, tôi có thể hỗ trợ gia đình tốt hơn và góp phần vào quá trình chữa bệnh.","Tôi rất vui vì bạn nhận ra tầm quan trọng của việc tự chăm sóc bản thân. Hãy nhớ rằng việc chăm sóc bản thân giúp bạn có mặt trọn vẹn vì những người thân yêu của mình. Khi chúng ta kết thúc phần này, chúng ta hãy suy ngẫm về những tiến bộ mà bạn đã đạt được. Bạn có điều gì khác muốn thảo luận hoặc có câu hỏi nào dành cho tôi không?"
Dự đoán giá cổ phiếu của Tập đoàn Intel (INTC) vào cuối tháng này.,"Là một mô hình ngôn ngữ AI, tôi không có khả năng dự đoán chính xác giá cổ phiếu của bất kỳ công ty nào vì nó bị ảnh hưởng bởi nhiều yếu tố, tin tức và sự kiện phức tạp bên ngoài dữ liệu đào tạo của tôi. Bạn nên tham khảo ý kiến ​​của các chuyên gia tài chính hoặc tiến hành nghiên cứu và phân tích thích hợp về xu hướng thị trường, báo cáo tài chính và tin tức trước khi đưa ra bất kỳ quyết định nào liên quan đến chứng khoán."
"Hiện tại, tôi cảm thấy như chúng ta đã giải quyết được những mối quan tâm chính. Tôi háo hức khám phá thêm những chủ đề này và tìm hiểu các chiến lược để nâng cao kỹ năng nuôi dạy con cái của mình. Cảm ơn bạn đã hiểu biết và hướng dẫn của bạn.",Không có gì. Rất vui được đồng hành cùng bạn trên hành trình này. Chúng tôi sẽ tiếp tục khám phá và giải quyết những lo lắng về việc nuôi dạy con cái của bạn trong các buổi học sắp tới. Hãy nhớ đối xử nhẹ nhàng với bản thân và ăn mừng những tiến bộ bạn đạt được. Hãy cẩn thận và tôi mong chờ cuộc trò chuyện tiếp theo của chúng ta.
Tôi cho rằng việc dành ra những khoảng thời gian cụ thể để viết có thể giúp tôi ưu tiên việc đó. Tôi sẽ cố gắng hết sức để tạo ra một lịch trình phù hợp với mình.,"Đó chính là tinh thần! Hãy nhớ rằng, những bước nhỏ sẽ dẫn đến sự tiến bộ đáng kể. Kỷ niệm mọi cột mốc quan trọng trên đường đi và đối xử tốt với chính mình trong suốt quá trình này."
"Cảm ơn. Sự hỗ trợ của bạn có nghĩa là cả thế giới đối với tôi lúc này. Tôi đã phải vật lộn với chứng nghiện rượu. Nó bắt đầu như một cách để đối phó với căng thẳng, nhưng nó nhanh chóng vượt khỏi tầm kiểm soát. Nó đã ảnh hưởng đến sức khỏe thể chất của tôi, gây tổn thương gan và các biến chứng khác. Tôi biết đã đến lúc phải thay đổi.",", cần có sức mạnh để đối mặt với những tổn thương của chính mình và nhận ra sự cần thiết phải thay đổi. Tôi khen ngợi bạn vì đã thực hiện bước này. Khi chúng ta tìm hiểu sâu hơn về chứng nghiện của bạn, chúng ta cũng hãy xem xét tình trạng sức khỏe tổng thể của bạn. Bạn có nhận thấy bất kỳ thay đổi nào về sức khỏe tinh thần và cảm xúc của mình do chứng nghiện không?"
"Chà, tôi cũng có thể cố gắng thấu hiểu và kiên nhẫn hơn với anh ấy. Có lẽ có điều gì đó xảy ra trong cuộc sống khiến anh ấy phải rút lui. Việc thể hiện sự đồng cảm và hỗ trợ có thể giúp anh ấy cảm thấy cởi mở hơn trong việc giải quyết mối quan hệ của chúng tôi.","Đó thực sự là một cách tiếp cận nhân ái. Điều quan trọng cần nhớ là tất cả chúng ta đều có những khó khăn riêng và đôi khi chúng có thể ảnh hưởng đến các mối quan hệ của chúng ta. Bằng cách đưa ra sự hiểu biết và hỗ trợ, bạn đang tạo ra một môi trường khuyến khích sự dễ bị tổn thương và phát triển."
"Tôi bắt đầu viết nhật ký như một cách để bày tỏ cảm xúc của mình và nó đã giúp tôi hiểu rõ hơn. Tôi cũng đã liên hệ với một số người bạn thân, những người đã hiểu và ủng hộ. Nhưng vẫn có những lúc cảm thấy nỗi cô đơn tràn ngập.","Viết nhật ký có thể là một công cụ mạnh mẽ để xử lý cảm xúc và đạt được sự rõ ràng. Thật tuyệt vời khi bạn đã tìm kiếm sự hỗ trợ từ bạn bè trong thời điểm khó khăn này. Hãy nhớ rằng việc chữa lành không phải là một con đường tuyến tính và sẽ có những thăng trầm. Bạn đã cân nhắc tìm kiếm sự hỗ trợ bổ sung, chẳng hạn như tham gia nhóm hỗ trợ đau buồn hoặc tư vấn bác sĩ trị liệu chưa?"
"Đó là một ý tưởng tuyệt vời. Tôi đã từng viết nhật ký khi chúng tôi bên nhau, vì vậy có lẽ việc đọc lại nó sẽ mang lại sự rõ ràng hơn. Tôi sẽ thử.","Thật tuyệt vời khi được nghe điều đó. Hãy nhớ rằng, không có áp lực phải viết nhật ký hàng ngày hoặc viết theo bất kỳ cấu trúc cụ thể nào. Mục tiêu là cho phép bản thân có một không gian không phán xét để bộc lộ cảm xúc và suy nghĩ của mình."
  I feel like I'm not good enough for my job and I'm constantly scared of being fired. ," It's not uncommon to feel this way, and it's important to remember that your employer hired you for a reason. Let's explore these thoughts and feelings further to work on changing them."
"Chà, giờ bạn nhắc đến điều đó, tôi nhớ lại một lần ở trường trung học, tôi đã cãi nhau với những người bạn thân nhất của mình. Đó là một trải nghiệm đau đớn vì nó khiến tôi đặt câu hỏi về giá trị của mình và liệu tôi có thực sự thuộc về nơi nào không. Kể từ đó, tôi gặp khó khăn trong việc tin tưởng và cởi mở với người khác, vì sợ rằng mình sẽ một lần nữa bị cô lập.","Có vẻ như việc bất hòa với bạn bè đã ảnh hưởng đáng kể đến lòng tự trọng và khả năng tin tưởng người khác của bạn. Những vết thương đó có thể mất thời gian để lành lại, nhưng điều quan trọng cần nhớ là động lực ở trường trung học không quyết định giá trị hoặc khả năng hình thành các mối quan hệ của bạn. Nhìn chung bạn cảm thấy thế nào về bản thân?"
"I've been feeling really regretful lately. It's this constant weight that's been dragging me down. Every time I think about all the things I should've done differently, she comes to mind.","I'm so sorry to hear that. It sounds like these regrets are causing a lot of distress for you. Can you tell me more about who ""she"" refers to?"
Tôi sợ quá. Tôi không biết phải làm gì với chồng mình. Mối quan hệ của chúng tôi giống như một chuyến tàu lượn siêu tốc và tôi không thể theo kịp nó được nữa.,", tôi có thể cảm nhận được sự phấn khích và sợ hãi qua lời nói của bạn. Có vẻ như mọi chuyện giữa bạn và chồng đang trở nên khá căng thẳng. Bạn có thể cho tôi biết thêm về những gì đang xảy ra?"
Tôi có thể nói với họ rằng tôi xin lỗi vì những lời lẽ gây tổn thương mà tôi đã sử dụng và rằng tôi không bao giờ có ý làm họ đau đớn. Tôi bày tỏ mong muốn nỗ lực cải thiện khả năng giao tiếp của chúng ta và tìm ra những cách lành mạnh hơn để giải quyết xung đột trong tương lai.,"Nghe có vẻ như một lời xin lỗi chân thành và chân thành. Tôi tò mò, bạn đã cân nhắc khả năng thảo luận về những cách lành mạnh hơn để giải quyết xung đột với bạn mình chưa? Mở ra một cuộc đối thoại về vấn đề này có thể mang lại lợi ích cho cả hai bạn."
"Chà, tôi cũng đang vật lộn với sự nghi ngờ bản thân. Tôi thường đặt câu hỏi liệu mình có những yếu tố cần thiết để thành công trong ngành công nghiệp âm nhạc đầy cạnh tranh hay không. Nỗi sợ thất bại và bị từ chối đôi khi có thể khiến bạn tê liệt.",Sự nghi ngờ bản thân là trở ngại chung mà nhiều nghệ sĩ phải đối mặt. Sẽ rất hữu ích nếu bạn nhắc nhở bản thân về điểm mạnh và phong cách độc đáo của mình. Hãy nhớ rằng bạn có khả năng tạo ra thành công cho riêng mình. Bạn có thể làm gì để xây dựng niềm tin vào khả năng của mình?
"Đó chỉ là tất cả, bạn biết không? Công việc đòi hỏi khắt khe vô cùng và tôi cảm thấy mình không bao giờ có thể nghỉ ngơi. Nó đang gây tổn hại đến sức khỏe tinh thần và thể chất của tôi. Và về những mất mát, gần đây tôi đã mất việc và chấm dứt một mối quan hệ lâu dài. Cảm giác như tôi đang mất dần nhận thức về bản thân.","Tôi có thể tưởng tượng cảm giác choáng ngợp và mất phương hướng như thế nào khi phải trải qua những mất mát cả về nghề nghiệp lẫn cá nhân. Mất việc thường có thể khiến chúng ta đặt câu hỏi về kỹ năng và mục đích của mình, đồng thời việc kết thúc một mối quan hệ có thể khiến chúng ta cảm thấy trống rỗng và cô đơn. Những mất mát này đã ảnh hưởng đến cuộc sống hàng ngày của bạn như thế nào?"
So sánh quy định và bãi bỏ quy định.,"Quy định và bãi bỏ quy định thể hiện những cách tiếp cận trái ngược nhau về vai trò của chính phủ trong việc giám sát các doanh nghiệp và ngành công nghiệp. Quy định đề cập đến việc chính phủ tạo ra, thực hiện và thực thi các quy tắc và tiêu chuẩn, trong khi việc bãi bỏ quy định đề cập đến việc giảm bớt hoặc loại bỏ các quy tắc này. Trong bối cảnh quy định, các chính phủ tìm cách bảo vệ người tiêu dùng, thúc đẩy cạnh tranh và ngăn chặn độc quyền bằng cách thiết lập các hướng dẫn và giám sát hoạt động của các công ty trong ngành được quản lý. Điều này có thể liên quan đến việc thành lập các cơ quan quản lý, chẳng hạn như Cơ quan Bảo vệ Môi trường hoặc Ủy ban Chứng khoán và Giao dịch, giám sát và thực thi việc tuân thủ các quy tắc do chính phủ đặt ra. Các ngành thường xuyên phải tuân theo quy định bao gồm ngân hàng, y tế, viễn thông và năng lượng. Mặt khác, việc bãi bỏ quy định dựa trên niềm tin rằng sự can thiệp ít hơn của chính phủ vào thị trường có thể dẫn đến cạnh tranh gia tăng, giá thấp hơn và tăng cường đổi mới. Những người ủng hộ việc bãi bỏ quy định cho rằng quy định quá mức có thể kìm hãm sự tăng trưởng kinh doanh và hạn chế các lựa chọn dành cho người tiêu dùng. Trong thực tế, việc bãi bỏ quy định thường liên quan đến việc loại bỏ hoặc nới lỏng các quy định và yêu cầu mà doanh nghiệp cho là nặng nề hoặc không cần thiết. Có những lập luận xác đáng cho cả quy định và bãi bỏ quy định, và việc tìm ra sự cân bằng phù hợp giữa hai quy định này thường là vấn đề tranh luận về chính trị và kinh tế. Cuối cùng, quyết định điều chỉnh hoặc bãi bỏ quy định của một ngành phụ thuộc vào nhiều yếu tố, bao gồm bản chất của ngành, mục tiêu của chính phủ và nhu cầu của người tiêu dùng."
"That's an interesting perspective. I've been so focused on what she's doing wrong that I haven't taken the time to fully understand my own emotions in this situation. Perhaps by expressing my own vulnerability, it will invite her to do the same and bridge the emotional gap that has formed between us.","It's often through vulnerability and open communication that genuine connection can be reestablished. By expressing your emotions, you create a space for your wife to truly see and understand the depth of your pain. Remember, it's essential to approach these conversations with love and empathy for both yourself and your wife."
"I guess I could join local clubs or organizations, meet my colleagues, and try to engage in community events. It's just hard for me to put myself out there and meet new people.","I understand that it can be challenging to step out of your comfort zone. Remember, courage doesn't mean being without fear but rather facing it. What are some small steps you can take to gradually expand your social circle?"
"
Diện tích hình vuông có chu vi là 16 là bao nhiêu?: 

Không đầu vào.
","Nếu chu vi của hình vuông là 16 thì mỗi cạnh của nó sẽ có số đo là 16 ữ 4 = 4. Diện tích của hình vuông khi đó sẽ là cạnh x cạnh, tức là `4 × 4 = 16`. Vậy diện tích hình vuông có chu vi 16 là 16 đơn vị vuông."
"Tôi nghĩ mình chỉ cần tìm cách cân bằng lòng biết ơn vì đã đạt được ước mơ của mình với cảm giác cô đơn này. Có lẽ bằng cách liên hệ với những người khác và chia sẻ hành trình của mình, tôi có thể tìm thấy niềm an ủi khi biết rằng mình không đơn độc trong trải nghiệm này.","Nghe có vẻ là một bước tiến tuyệt vời. Hãy nhớ rằng, bạn không phải đối mặt với điều này một mình. Tôi ở đây để hỗ trợ bạn và ngoài kia còn có những người khác có thể hiểu và thông cảm với những gì bạn đang trải qua. Mở lòng mình với những kết nối mới và chia sẻ câu chuyện của bạn có thể mang lại cảm giác thân thuộc sâu sắc hơn."
Gần đây tôi cảm thấy vô cùng lo lắng. Tâm trí tôi luôn bị phân tâm và dường như tôi không thể tập trung vào bất cứ điều gì. Vợ tôi cũng nhận thấy điều đó và cô ấy bắt đầu lo lắng. Tôi không biết phải làm gì.,Tôi hiểu. Sự lo lắng có thể tràn ngập. Thật tuyệt khi vợ bạn chú ý và quan tâm đến sức khỏe của bạn. Lần đầu tiên bạn bắt đầu cảm thấy như vậy là khi nào? Có điều gì cụ thể gây ra cảm giác lo lắng của bạn không?
"Cảm ơn. Tôi đánh giá cao những lời động viên của bạn. Tôi sẽ cố gắng hết sức để tiếp cận hội họa với một tư duy tích cực và đón nhận cuộc hành trình, bất kể nó có khó khăn đến đâu. Tôi rất biết ơn khi có bạn ở góc của tôi.","Đó là niềm hân hạnh của tôi. Tôi ở đây để trở thành hệ thống hướng dẫn và hỗ trợ của bạn. Hãy nhớ rằng, ngay cả khi mọi thứ trở nên khó khăn, đừng ngần ngại liên hệ với tôi. Cùng nhau, chúng ta sẽ điều hướng hành trình này theo hướng khám phá lại khả năng sáng tạo và nâng cao lòng tự trọng của bạn. Bạn mạnh mẽ hơn bạn nghĩ và tôi tin rằng bạn sẽ bước ra khỏi chuyện này mạnh mẽ và hạnh phúc hơn."
Nghe có vẻ là một ý tưởng tuyệt vời! Mọi thứ sẽ dễ quản lý hơn nhiều nếu tôi thực hiện từng bước một.,"Tôi mừng vì anh cảm thấy như vậy. Hãy nhớ rằng, điều quan trọng là phải kiên nhẫn với chính mình trong suốt quá trình này. Rome không được xây dựng trong một ngày! Bạn có thể nghĩ ra một nhiệm vụ cụ thể mà bạn cảm thấy có thể chia thành các bước nhỏ hơn không?"
"Xin chào , tôi hy vọng hôm nay bạn làm tốt. Tôi muốn nói chuyện với ai đó về cảm giác của mình - gần đây quả là khoảng thời gian khó khăn đối với tôi. Tôi cảm thấy rất xấu hổ về cuộc chia tay gần đây của mình và tôi nghĩ nó có thể liên quan đến chứng nghiện của tôi.","Xin chào , tôi rất vui vì bạn đã liên hệ. Cần có can đảm để cởi mở về cảm xúc và trải nghiệm của bạn. Tôi ở đây để hỗ trợ bạn trong suốt hành trình này. Bạn có thể cho tôi biết thêm về ý nghĩa của việc bạn nói cảm giác xấu hổ và bạn nghĩ nó có liên quan như thế nào đến chứng nghiện của bạn không?"
"It definitely took a toll on my confidence. Even now, as an adult, I find myself constantly second-guessing my abilities and worrying about what others think of me. It's hard to trust myself and see my own worth when I've been conditioned to believe I'm not good enough.","It's understandable that bullying can have long-lasting effects on one's self-confidence. It's important to recognize that the hurtful actions of others are not a reflection of your true worth. , what strategies have you tried so far to overcome these insecurities?"
"Xin chào , gần đây tôi cảm thấy thực sự không vui, đặc biệt là khi nói đến sự nghiệp của mình. Tôi dường như không thể tìm thấy bất kỳ sự thỏa mãn hay niềm vui nào trong công việc mình làm.","Xin chào , tôi rất tiếc khi biết rằng bạn đang cảm thấy không vui. Sẽ vô cùng khó khăn khi chúng ta không tìm thấy sự hài lòng trong sự nghiệp của mình. Bạn có thể cho tôi biết thêm một chút về điều gì cụ thể khiến bạn cảm thấy như vậy không?"
"Chắc chắn. Tôi từng cảm thấy hào hứng với những dự án và thử thách mới, nhưng giờ đây tôi chỉ cảm thấy kiệt sức và kiệt sức. Giống như niềm đam mê của tôi đã bị hút ra khỏi tôi.",Tôi có thể hiểu được cảm giác đó thực sự chán nản như thế nào. Có vẻ như bạn đang bị mất đi động lực và niềm vui trong cuộc sống. Có bất kỳ lĩnh vực nào khác mà bạn nhận thấy mô hình này không?
"Tôi nghĩ việc nhắc nhở bản thân rằng cảm thấy đau là điều bình thường và đó là một phần của quá trình chữa lành có thể hữu ích. Ngoài ra, tôi thừa nhận rằng tôi xứng đáng được yêu thương và hạnh phúc, ngay cả sau khi trải qua nỗi đau này. Tôi sẽ cố gắng kết hợp những lời khẳng định này vào quá trình viết nhật ký của mình.","Những lời khẳng định đó nghe có vẻ mạnh mẽ. Hãy nhớ rằng, việc chữa lành cần có thời gian và sự kiên nhẫn. Bằng cách tôn trọng cảm xúc của mình và rèn luyện lòng từ bi với bản thân, bạn đang mở đường cho một tương lai tươi sáng và hạnh phúc hơn. Có điều gì khác mà bạn muốn khám phá hoặc thảo luận ngày hôm nay không?"
"Cảm ơn. Bạn thấy đấy, tôi luôn có ước mơ trở thành một nhạc sĩ chuyên nghiệp. Đó là điều đã mang lại cho tôi rất nhiều niềm vui và sự thỏa mãn trong suốt những năm qua. Nhưng gần đây, tôi đang cố gắng tin rằng điều đó có thể trở thành sự thật.",Có vẻ như anh có niềm đam mê sâu sắc với âm nhạc. Điều đó thật tuyệt vời. Tôi có thể cảm nhận được niềm hy vọng và quyết tâm của bạn để biến ước mơ của bạn thành hiện thực. Bạn có thể cho tôi biết thêm về những lo lắng cụ thể và cảm giác tiếc nuối mà bạn đang trải qua không?
Tất nhiên rồi. Tôi nghĩ sự cô đơn bắt nguồn từ sự mất mát mà tôi vừa trải qua. Người bạn thân nhất của tôi đột ngột qua đời và điều đó để lại một khoảng trống trong cuộc đời tôi. Chúng tôi đã từng dành rất nhiều thời gian bên nhau và giờ tôi cảm thấy như thiếu một phần quan trọng nào đó trong mình.,Tôi thực sự rất tiếc khi biết về sự ra đi của người bạn thân nhất của bạn. Mất đi người mà chúng ta yêu thương có thể tạo ra cảm giác trống rỗng và khao khát sâu sắc. Bạn có thể cho tôi biết thêm về tác động của sự mất mát này đối với cuộc sống hàng ngày của bạn không?
"Chà, tôi đang cảm thấy chán nản và nó cũng ảnh hưởng đến tâm trạng của tôi ngoài giờ làm việc. Tôi thấy thật khó để tận hưởng những điều từng khiến tôi hạnh phúc.",Có vẻ như bạn đang trải qua một khoảng thời gian khó khăn. Một số điều bạn từng thích nhưng không còn mang lại cho bạn niềm vui nữa là gì?
Suggest three potential applications of AI technology in the healthcare industry.?,"AI could be used in the healthcare industry to predict patient outcomes, automate administrative tasks, and diagnose diseases accurately."
